{
  "id": "elit exercitation sunt",
  "activeFromDate": "1979-06-08",
  "satisfactionTechnicalSupportRank": 56416659,
  "supplierScore": 87879518,
  "satisfactionWeightScore": -4463729,
  "isCarrier": true,
  "contractProductQualityRate": 75959582,
  "satisfactionCustomerServiceRank": 85870386,
  "contractDeliveryCorrectnessRate": 4272025,
  "contractSourcingCycleDays": -81217752,
  "contractWeightScore": 40961385,
  "competitiveWeightScore": -59751722,
  "competitiveProductPriceRank": -97107508,
  "contractOnTimeDeliveryRate": 11291062
}
